{
  "guidance": "Experiences are short phrases (one to a few words) that describe a meaningful part of a character's background, talents, or training. When an Experience plausibly applies to a roll, the player may spend a Hope to add its bonus to that roll. Players define their own Experiences; the GM has final say on whether they fit the tone of the table.",
  "startingBonus": 2,
  "startingCount": 2,
  "examples": [
    { "id": "exp-blacksmith", "name": "Blacksmith", "category": "profession" },
    { "id": "exp-bounty-hunter", "name": "Bounty Hunter", "category": "profession" },
    { "id": "exp-charming-smile", "name": "Charming Smile", "category": "trait" },
    { "id": "exp-city-guard", "name": "City Guard", "category": "profession" },
    { "id": "exp-cloak-and-dagger", "name": "Cloak and Dagger", "category": "skill" },
    { "id": "exp-courtly-manners", "name": "Courtly Manners", "category": "skill" },
    { "id": "exp-explorer", "name": "Explorer", "category": "profession" },
    { "id": "exp-fast-learner", "name": "Fast Learner", "category": "trait" },
    { "id": "exp-field-medic", "name": "Field Medic", "category": "skill" },
    { "id": "exp-gambler", "name": "Gambler", "category": "skill" },
    { "id": "exp-grew-up-on-the-streets", "name": "Grew Up on the Streets", "category": "background" },
    { "id": "exp-hunter", "name": "Hunter", "category": "profession" },
    { "id": "exp-knows-a-guy", "name": "Knows a Guy", "category": "connections" },
    { "id": "exp-light-sleeper", "name": "Light Sleeper", "category": "trait" },
    { "id": "exp-merchant", "name": "Merchant", "category": "profession" },
    { "id": "exp-noble-born", "name": "Noble-Born", "category": "background" },
    { "id": "exp-pickpocket", "name": "Pickpocket", "category": "skill" },
    { "id": "exp-quick-tongue", "name": "Quick Tongue", "category": "trait" },
    { "id": "exp-runaway", "name": "Runaway", "category": "background" },
    { "id": "exp-sailor", "name": "Sailor", "category": "profession" },
    { "id": "exp-scholar", "name": "Scholar", "category": "profession" },
    { "id": "exp-scout", "name": "Scout", "category": "profession" },
    { "id": "exp-silver-tongued", "name": "Silver-Tongued", "category": "trait" },
    { "id": "exp-soldier", "name": "Soldier", "category": "profession" },
    { "id": "exp-survivalist", "name": "Survivalist", "category": "skill" },
    { "id": "exp-thief", "name": "Thief", "category": "profession" },
    { "id": "exp-tinkerer", "name": "Tinkerer", "category": "skill" },
    { "id": "exp-tracker", "name": "Tracker", "category": "skill" },
    { "id": "exp-travelling-performer", "name": "Travelling Performer", "category": "profession" },
    { "id": "exp-woodsman", "name": "Woodsman", "category": "profession" }
  ]
}
